url,url_hash,title,description,published_at,source_id,source_name,crawl_method,language,paywall,text,content_hash,extract_method,text_len,method_rank
https://finance.yahoo.com/news/volvo-announces-strategic-plan-skirt-091500073.html,a00f3b3140206e3e8f6b35c7b1faedee,Volvo announces strategic plan to skirt US tariffs and it could be a game changer for affordable EVs,Volvo announces strategic plan to skirt US tariffs and it could be a game changer for affordable EVs,2025-08-10 13:45:00+00:00,gdelt_finance_yahoo_com,finance.yahoo.com via GDELT,gdelt,en,False,"Volvo announces strategic plan to skirt US tariffs — and it could be a game changer for affordable EVs
In an effort to skirt steep tariffs on Chinese-made goods, Volvo plans to move some production of its electric vehicle stock to Europe — and will debut a new model in its wake.
The Swedish carmaker plans to build the compact Polestar 7 EV at its new plant in Kosice, Slovakia, starting in 2028, InsideEVs reported. The latest model will be the first Polestar car made in Europe, and the facility will be able to produce 250,000 units per year when it opens.
The move comes in the wake of tariffs imposed by the Trump administration, which will heavily impact companies that outsource manufacturing to China. Volvo has chosen the Slovakia plant for EV production to sidestep this issue and continue sales to the crucial U.S. market.
Volvo's premium EV spinoff marked the start of 2025 with an exciting finish to the first quarter, which saw a 76% sales increase year over year. Polestar has struggled to gain ground in the EV market, though a recent strategic reset for the brand and shifting interest for buyers has played to its advantage.
By taking advantage of new momentum with this manufacturing shift, Polestar is jockeying for a favored position among American drivers looking to switch to an EV. More potential buyers are moving toward this option for cost reasons, namely the savings on routine maintenance and fuel.
Many also see EVs as the most environmentally friendly option because of the lack of tailpipe pollution. While there are concerns about lithium battery production, as well as the pollution created through charging these cars, the Department of Energy notes that EVs produce six times less carbon pollution annually than gas-powered counterparts.
Combined with other clean energy measures — like home solar panels to charge an EV — owners can limit energy consumption while saving money over time. EnergySage makes the solar installation process easy, allowing potential buyers to compare quotes from local installers — and even save up to $10,000 on the investment.
While the latest Polestar model won't be available stateside until at least 2028, potential EV buyers can expect the car to feature Volvo's next-generation software-defined vehicle platform,
cell-to-body battery packs, and more of the Swedish brand's most cutting-edge features.
Join our free newsletter for good news and useful tips, and don't miss this cool list of easy ways to help yourself while helping the planet.",87b156ac5d5e0ab733e1582f4f4e53eb,trafilatura,2515,0
https://finance.yahoo.com/news/td-cowen-maintains-buy-p-040006823.html,f7189b2f52c23260836afb5967f7c5f1,"TD Cowen Maintains Buy on P & G ( PG ), Citing Innovation and Leadership Shift","TD Cowen Maintains Buy on P & G ( PG ), Citing Innovation and Leadership Shift",2025-08-10 22:15:00+00:00,gdelt_finance_yahoo_com,finance.yahoo.com via GDELT,gdelt,en,False,"The Procter & Gamble Company (NYSE:PG) is one of the best defensive stocks to invest in according to analysts. The company reported its Q4 2025 (FY ends in June) on July 29 with $84.3 billion in revenue and $6.83 in EPS. In fiscal 2025, the company delivered more than $16 billion in shareholder returns, including $9.9 billion in dividends and $6.5 billion through share buybacks.
Following the results, TD Cowen analyst Robert Moskow reiterated his Buy rating on Procter & Gamble, maintaining a $168 price target. His view remains constructive, even as the company wrapped up the fiscal year on a softer note and issued a wide earnings guidance range for FY26.
Copyright: jetcityimage / 123RF Stock Photo
Moskow believes that there is uncertainty in the near term due to macroeconomic challenges such as geopolitical risks and shifting tariff policies that could weigh on performance. However, he sees these factors as manageable as he remains confident over P&G’s strategic direction.
A key part of the bullish thesis lies in P&G’s commitment to product innovation. Moskow expects this focus will help the company gain ground against peers, particularly as it looks to reclaim market share in core U.S. categories like Skin Care and diapers. While pricing dynamics may fluctuate, especially if tariffs begin to impact cost structures, he believes P&G will continue to adjust pricing to preserve margins.
The company has already announced a CEO transition (COO Shailesh Jejurikar to become CEO effective January 1, 2026), which is also seen as an opportunity for renewed strategic clarity. Moskow anticipates that under new leadership, P&G will sharpen its execution and prioritize initiatives that support longer-term growth.
The Procter & Gamble Company (NYSE:PG) is a consumer goods company that creates, manufactures, markets, and distributes a diversified portfolio of daily-use products such as fabric & home care, beauty, grooming, baby, feminine & family care.
While we acknowledge the potential of PG as an investment, we believe certain AI stocks offer greater upside potential and carry less downside risk. If you’re looking for an extremely undervalued AI stock that also stands to benefit significantly from Trump-era tariffs and the onshoring trend, see our free report on the best short-term AI stock.
READ NEXT: 10 Most Oversold S&P 500 Stocks So Far in 2025 and 10 Most Oversold Semiconductor Stocks So Far in 2025.
Disclosure: None. This article is originally published at Insider Monkey.",3bff08c0ceb657ed6677347f4cd90c96,trafilatura,2508,0
https://ca.finance.yahoo.com/news/trumps-tariff-hike-hits-world-145428791.html,9aacba2bdbdc9d53752e036a03aae328,Carney says he focused on building up Canada as Trump global trade war escalates,Carney says he focused on building up Canada as Trump global trade war escalates,2025-08-10 09:15:00+00:00,gdelt_finance_yahoo_com,finance.yahoo.com via GDELT,gdelt,en,False,"WASHINGTON — Prime Minister Mark Carney said Thursday Canadians are focused on building up their economy after U.S. President Donald Trump again hit nations around the world with increased tariffs — days after slapping Canada with a higher duty.
Carney said there is a lot to do in Canada and his government is focused on ""what we can control.""
""Yes we are having discussions with the Americans but Canadians want us to focus here at home,"" the prime minister told reporters in Ottawa.
Trump escalated his trade war last week by hitting Canada with a baseline 35 per cent tariff that applies only to goods not covered by the Canada-United States-Mexico Agreement on trade, better known as CUSMA.
Just after midnight on Thursday, U.S. tariffs on goods from more than 60 other nations and the European Union were increased. The duties range from a low of 10 per cent to 50 per cent for Brazil.
""BILLIONS OF DOLLARS IN TARIFFS ARE NOW FLOWING INTO THE UNITED STATES OF AMERICA!"" Trump posted on social media just after the duties took effect.
The EU, Japan and South Korea — which have brokered trade agreement frameworks with the Trump administration — saw U.S. tariffs increase to 15 per cent. Bangladesh and Vietnam were hit with 20 per cent duties. Switzerland saw its tariff increase to 39 per cent.
Nations are also being hit with Trump's separate tariffs on steel, aluminum, copper and automobiles.
American tariffs are now at a level not seen in the U.S. in almost a century. The Budget Lab at Yale, a non-partisan policy research centre, has said Americans will see an average tax of 18.3 per cent on imported products, the highest rate since 1934.
Ontario Premier Doug Ford told media outlet CNN on Wednesday that ""a tariff on Canada is a tax on the American people.""
""This is hurting the American people,"" Ford said, adding that Canada and other countries are ""diversifying our trade.""
When asked how Canadians view Trump, Ford said he's ""probably the most disliked politician in the world in Canada because he's attacked his closest family member, and that's the way we look on it.""
""And when I talk to the governors, senators and congresspeople, even Republicans totally disagree, but they're too scared to come out and say anything because the president will go after them,"" he added.
Signs are emerging that Trump's tariffs are starting to drag down the American economy. After the release of a bleak jobs report last week, Trump fired the head of the agency that produces the monthly figures.",6076b4bfb0377dc27185aee5466d171d,trafilatura,2505,0
https://finance.yahoo.com/news/10-000-metals-company-stock-160300496.html,c2ad4cd3762bf073193a362161920648,"Can $10 , 000 in The Metals Company Stock Turn Into $50 , 000 by 2030 ? ","Can $10 , 000 in The Metals Company Stock Turn Into $50 , 000 by 2030 ? ",2025-08-10 17:45:00+00:00,gdelt_finance_yahoo_com,finance.yahoo.com via GDELT,gdelt,en,False,"Key Points
-
TMC The Metals Company stock has been a huge winner in 2025, and its share price has more than quadrupled year to date.
-
The company has seen huge gains as the importance of the the United States' domestic mineral sourcing capabilities has come into focus.
-
TMC is a very risky investment, but there are realistic scenarios in which the stock could keep rocketing higher.
TMC The Metals Company (NASDAQ: TMC) has been one of the market's most explosive stocks across 2025's trading. Even after a recent pullback, the company's share price has surged roughly 368% year to date as of this writing.
TMC's huge gains have been powered by expectations that regulatory shifts and other political dynamics will fast-track the seabed mining specialist's path to operational deployment and rapid growth. If you're wondering whether the mining company has what it takes to turn a $10,000 investment into $50,000 or more over the next five years, read on for a look at key dynamics that could shape the stock's performance over that time frame.
Could TMC 5x over the next five years?
TMC's business is still in a pre-revenue state, and its stock is a risky investment candidate. On the other hand, some key dynamics have been moving in the company's favor -- and there are feasible outcomes that could result in its share price surging far above current levels.
President Donald Trump signed an executive order in April to expedite permitting applications for seabed mining operations, and TMC responded by submitting several applications for regulatory approvals. Seabed mining capabilities could be crucial to helping to improve the United States' ability to source rare earth minerals domestically. Along those lines, the recent pullback for TMC stock has actually been driven by signs suggesting that the Trump administration could reach a trade agreement with China that secures future access to Chinese minerals.
With a market capitalization of roughly $1.9 billion, TMC is still a relatively small company. Its stock is also a highly speculative investment play. While the company's shares come with a very high level of investment risk, I think there's actually a very good chance that its valuation will bound well above current levels. Whether or not the company's stock can deliver 5x returns over the next five years remains to be seen, but geopolitical dynamics and the importance of rare earth mineral sourcing suggest the potential is there even if that outcome is far from a safe bet.",6cb293480e12760efd6a97fd64585822,trafilatura,2504,0
https://finance.yahoo.com/news/why-xrp-ripple-soaring-today-210306452.html,de709c2e717656ac600fbd6a6167b96f,Why XRP ( Ripple ) Is Soaring Today,Why XRP ( Ripple ) Is Soaring Today,2025-08-10 04:30:00+00:00,gdelt_finance_yahoo_com,finance.yahoo.com via GDELT,gdelt,en,False,"Key Points
-
Ripple announced a major new acquisition on Thursday, leading to today's spike.
-
Ripple says the acquisition builds a ""comprehensive"" stablecoin solution.
-
Investors hope this will drive XRP demand.
XRP (CRYPTO: XRP) is gaining on Friday. From 4 p.m. ET yesterday, the cryptocurrency is up 5.1% as of 3:52 p.m. ET. The move comes as Bitcoin was mostly flat.
Ripple, the company behind XRP, announced a major acquisition that could help boost XRP demand.
Ripple is betting on stablecoins
Ripple announced yesterday that it has agreed to purchase Rail, a stablecoin platform, for $200 million. Ripple says that the acquisition will deliver the ""most comprehensive stable coin payment solution on the market.""
Ripple is trying to take advantage of the excitement around stablecoin adoption. With the recent passage of the Genius Act, stablecoins could become a substantial part of the traditional financial system.
Ripple President Monica Long said in a statement that with the acquisition, ""Ripple was uniquely positioned to drive the next phase of innovation and adoption of stablecoins and blockchain and global payments.""
While investors appeared to believe the acquisition would lead to increased adoption of XRP itself, it's not clear yet how much this will hold true.
XRP could be overvalued
It's possible that, like other aspects of Ripple's business, Rail won't directly translate to XRP adoption.
I continue to have doubts about its valuation. To be sure, XRP is a crypto with real-world utility already in widespread use -- and in a world of meme coins that is worth something -- but I'm not sure its current market cap of nearly $200 billion makes sense.
Should you buy stock in XRP right now?
Before you buy stock in XRP, consider this:
The Motley Fool Stock Advisor analyst team just identified what they believe are the 10 best stocks for investors to buy now… and XRP wasn’t one of them. The 10 stocks that made the cut could produce monster returns in the coming years.
Consider when Netflix made this list on December 17, 2004... if you invested $1,000 at the time of our recommendation, you’d have $636,563!* Or when Nvidia made this list on April 15, 2005... if you invested $1,000 at the time of our recommendation, you’d have $1,108,033!*
Now, it’s worth noting Stock Advisor’s total average return is 1,047% — a market-crushing outperformance compared to 181% for the S&P 500. Don’t miss out on the latest top 10 list, available when you join Stock Advisor.",fc9c627ab8ee17fdc7476711bde80591,trafilatura,2492,0
https://www.cnbc.com/2025/08/10/how-one-strategist-is-choosing-between-sky-high-valuations-and-value-.html,80f4f6ca0dbbd39569f675e552d98dcc,How one strategist is choosing between sky high valuations and value,How one strategist is choosing between sky high valuations and value,2025-08-10 12:30:00+00:00,gdelt_cnbc_com,cnbc.com via GDELT,gdelt,en,False,"There's still too little visibility from a policy perspective for investors to plant their feet in one direction or the other as stock valuations sit at record highs, according to BNY head of market strategy Robert Savage . Savage noted that picking between sticking with sky-high valuations and looking for value in an expensive market isn't a black and white decision. The S & P 500 currently trades at a forward price-to-earnings ratio of about 22 times, near the top of its historical average over the past 20 years, when it's averaged about a 16 times multiple, according to FactSet data. Megacap technology stocks are responsible for the majority of the S & P 500's rise in 2025, and much of its earnings growth in the second quarter. Some of the headwinds hanging over the market, he said, are how the Federal Reserve will handle short-term interest rates in September and President Donald Trump's tariffs. ""The idea of concentration risk of only a handful of stocks [that] are making all of the money and seeing all of the flow is not unique — we've seen this movie before,"" Savage told CNBC Pro in an interview. ""It usually gets taken out in a rotation trade. Are we due for a rotation trade? Sure, but it needs a catalyst, and that catalyst usually comes from the cycle changing."" ""It's really easy for us to pontificate on potential great story policies, but they're [only] narratives and the current environment is impeding clear investment goals,"" he added. With the market setting itself up for a pullback of maybe 5% in the near-term, Savage said he prefers commodities as opposed to equities. When looking for equities, he said he largely favors companies offering high cash flow. The concern, Savage said, is that there's little sign that the current makeup of the market is headed for a cycle change. For that to happen, there needs to be more clarity as to how the Federal Reserve will handle short-term interest rates, as well as how Trump's tariffs will affect the economy. For example, Savage said that the economy likely won't feel the full effects of the tariffs until October or November, two or three months from now. ""It's really hard for anyone to argue with me about growth or value when return on investment is a fundamental part of the math equation,"" Savage said. ""So even if the Fed does cut 50 basis points [half a percentage point], as everyone expects, it might not be sufficient to make that equation work."" ""Welcome to my world of uncertainty,"" he added.",580772ae1806e7e10eef97e1e1910740,trafilatura,2492,0
https://finance.yahoo.com/news/figma-21-billion-drop-returns-195754034.html,23b0fd73f4df37d5c53fc9e3539dc061,Figma $21 Billion Drop Returns Stock to Earth After IPO Frenzy,Figma $21 Billion Drop Returns Stock to Earth After IPO Frenzy,2025-08-10 02:30:00+00:00,gdelt_finance_yahoo_com,finance.yahoo.com via GDELT,gdelt,en,False,"(Bloomberg) -- Figma Inc. has taken investors who pounced on the year’s hottest initial public offering for a wild ride, shedding $21 billion from a peak in the days following its record-breaking IPO.
Most Read from Bloomberg
-
New York Warns of $34 Billion Budget Hole, Biggest Since 2009 Crisis
-
A New Stage for the Theater That Gave America Shakespeare in the Park
-
Chicago Schools’ Bond Penalty Widens as $734 Million Gap Looms
The San Francisco-based company’s shares have been trading on-and-off all week below the $85 level, where they opened on July 31, their first day in the market. Despite modest rebounds, the design software firm’s stock has given back much of the increase that briefly mesmerized Wall Street.
Figma’s 250% first-day pop was the largest in at least three decades for a US-listed company that raised more than $1 billion, data compiled by Bloomberg show. After further gains last week that lifted the stock to more than quadruple the price IPO buyers paid, Figma is now trading at around $80, down from a peak of $142.92 on Aug. 1.
“Figma was a testimony to the speculative nature of this market, abetted by some of the peculiarities of the IPO process,” said Steve Sosnick, chief strategist at Interactive Brokers. “Folks will probably lose interest and move onto the next situation if the stock persists below its opening print, even with the stock still up more than double over its IPO price.”
Part of the raucous debut can be credited to a tiny pool of available shares to trade — just 7% of the outstanding stock is in the public domain — meaning it was partly a product of an imbalance in demand and supply.
While recent debutants like Circle Internet Group Inc. have seen eye-popping returns, the drop off in trading volume and chatter on social media platforms that cater to individual investors show the group moved on after a few days as activity stalled. Recent IPOs including CoreWeave Inc. and Circle have more than tripled from their IPO prices, though both have wiped out more than 30% of their value from closing highs.
Figma’s market value currently stands at roughly $39 billion, down from a closing peak of almost $60 billion. However, the current price is still well above the range investors had been pitched in meetings before the IPO. The stock now trades at a price-to-sales ratio of roughly 37, vastly outstripping comparable firms like Adobe Inc., which attempted to buy Figma in 2023 and trades at a less than six times sales.",cf0f2ddfdd111cae59c5352da9022c9e,trafilatura,2485,0
https://finance.yahoo.com/news/zuber-issa-demands-petrol-station-160120557.html,dae00a0b14278043fc84f53dbbcedf55,Zuber Issa demands petrol station empire sell off $5bn US arm,Zuber Issa demands petrol station empire sell off $5bn US arm,2025-08-10 17:45:00+00:00,gdelt_finance_yahoo_com,finance.yahoo.com via GDELT,gdelt,en,False,"One of the billionaire brothers behind EG Group has urged the petrol station behemoth to sell off its $5bn (£3.7bn) US business in an apparent split with the company’s private equity backer.
Zuber Issa, who owns a 25pc stake in EG, said the company should hive off its American forecourts to a single buyer rather than pursuing a listing of the entire group as planned.
Mr Issa, along with his brother Mohsin, who also owns 25pc, built EG Group from a single station in Bury, Manchester into a major empire spanning hundreds of petrol stations.
EG is now 50pc owned by private equity group TDR Capital, which has been laying plans for a float of the business in New York.
However, in an apparent rebuke to TDR’s plans, Mr Issa has called for the separate sale of the US business rather than an outright float of the whole company.
“There are people who want to buy the US assets. It will be an auction process which would get to a clear end goal much quicker [than an IPO] and we can pay the debt off,” he told the Financial Times.
“The shareholders are still thinking about the options. Other options would be trying to sell the US in its entirety. And I think that should be an option we should do”.
New ventures
Mr Issa stepped down as co-chief executive of EG last year and is now a non-executive board member, focusing on his new venture EG On the Move after buying EG’s last forecourts in the UK.
EG Group was earlier this year exploring plans to sell off some European assets in countries like France and Germany to offload debt ahead of a stock market listing.
The Blackburn-born brothers founded Euro Garages, or EG, in 2001, after acquiring a single petrol station and proceeding to buy up forecourt sites from oil giants like Esso.
In 2016, they partnered with TDR Capital and merged Euro Garages with its European Forecourt Retail Group, turning it into EG Group. The rapid expansion was fuelled by borrowing, with the return of higher interest rates forcing the group to sell off parts to bring down debt.
In an ill-fated venture, the Issa brothers bought supermarket chain Asda in an £6.8bn acquisition with TDR in 2021. Zuber has since sold his 22.5pc Asda stake to TDR, giving them majority control.
EG Group employs nearly 40,000 people across more than 5,500 sites, serving close to 1bn customers a year. Among its operations in nine countries, the US generates the most revenue.
EG Group and TDR Capital declined to comment.",93a96d8167f075b6815989b420f5817b,trafilatura,2443,0
