url,url_hash,title,description,published_at,source_id,source_name,crawl_method,language,paywall,text,content_hash,extract_method,text_len,method_rank
https://finance.yahoo.com/news/capital-compounders-investors-202200101.html,b614a3896aff585cc3fbc0d2e5ee4fc3,Capital Compounders for Investors,Capital Compounders for Investors,2025-08-10 03:00:00+00:00,gdelt_finance_yahoo_com,finance.yahoo.com via GDELT,gdelt,en,False,"In this podcast, Motley Fool analysts Emily Flippen and Sanmeet Deo and contributor Jason Hall dig into four market beaters and ask: Can the flywheels keep spinning?
They unpack:
-
Earnings from old-school winners Axon and MercadoLibre, including how they turned skeptics into believers with consistent execution.
-
Results from new-school contenders Hims & Hers and Palantir, both of which face high levels of scrutiny despite strong performance.
-
Tariff math that matters and where pricing power may blunt cost headwinds.
To catch full episodes of all The Motley Fool's free podcasts, check out our podcast center. When you're ready to invest, check out this top 10 list of stocks to buy.
A full transcript is below.
Should you invest $1,000 in MercadoLibre right now?
Before you buy stock in MercadoLibre, consider this:
The Motley Fool Stock Advisor analyst team just identified what they believe are the 10 best stocks for investors to buy now… and MercadoLibre wasn’t one of them. The 10 stocks that made the cut could produce monster returns in the coming years.
Consider when Netflix made this list on December 17, 2004... if you invested $1,000 at the time of our recommendation, you’d have $636,563!* Or when Nvidia made this list on April 15, 2005... if you invested $1,000 at the time of our recommendation, you’d have $1,108,033!*
Now, it’s worth noting Stock Advisor’s total average return is 1,047% — a market-crushing outperformance compared to 181% for the S&P 500. Don’t miss out on the latest top 10 list, available when you join Stock Advisor.
*Stock Advisor returns as of August 4, 2025
This podcast was recorded on August 05, 2025.
Emily Flippen: Earnings from four companies that have the market beat by triple digits. But are they still growing fast enough for investors? Find out today on Motley Fool Money.
I'm Emily Flippen, and today I'm joined by analysts Sanmeet Deo and Jason Hall to talk about capital compounders. They're businesses that have reinvested for growth so rapidly that earnings and their market values have just snowballed over time. We have earnings out from two of these new school compounders that we'll discuss. But first, let's talk about some of the old school compounders that reported last night, both of which that have been defying that overvalued label for years. A quintessential element of being a Rule Breaker investment is being called overvalued. Sanmeet, let's start with Axon. Axon Enterprises just posted its 29% revenue growth with over $1.2 billion in annualized recurring revenue. They have contracted bookings growth of 43% year over year. Management also once again raised guidance. Now, when I rewind to August 2020, I find a Seeking Alpha article that claimed despite the strong unit economics of Axon, the stock was too expensive at around $80 a share and that its intrinsic value is closer to 74 ""at best"". Today, Axon after earnings trades for over $800 a share. What are your takeaways here?
Sanmeet Deo: This stock over a five-year period has grown 704%. That is really because of a consistent, strong execution and a powerful business model that's almost like a razor blade model where they're selling hardware and offering high-margin subscription, Cloud software, to complement that hardware. They have just continued to consistently over really that whole five-year period generate double-digit revenue growth, and this quarter was no different. They beat and raised on earnings and revenues, continued strong revenue growth, software services, providing that high margin growth. It's almost like, when is this company not going to perform? That's the worry. Really only concern of this company right now is its valuation, and that it's stretched. But with numbers like these, that valuation is justified for a growth company.
Emily Flippen: It's so funny to go back and find articles that compare a mere six dollars in price difference, that at the time when that article was written, $80 versus $74 probably felt like a lot. When you look at it where it is today, it's almost like splitting hairs. But I do have to ask, this is the definition of what it means to be a compounder, and a quintessential definition of a rule-breaking stock is that they always somehow look overvalued, but in order to compound, you just continue to grow and grow much faster than the market expects. In your opinion, does Axon have what it takes to continue to compound, or is this truly overvalued? Because there are moments where stocks truly are overvalued for the growth that they put forward.
Sanmeet Deo: Well, really, it's overvalued, and it's still a great investment compounding because growth are like muscles, they always need fuel. Growth is always needed with fuel. Axon has proven that their products and services right now are growing. There will be a limit to that. But growth investor is always looking for what's that next leg of growth? What is that other opportunity that can cause this company to continue to grow and continue to justify that premium valuation? Axon has international markets that can continue to grow in. It's looking to also possibly get into more of the federal enforcement agencies. That's a little tougher nut to crack, but that's something they're doing. Like we all hear from most other companies, AI. One cool thing that they're using with AI is their AI-powered software. They collect a lot of data from their body cameras and their hardwares. Gathering all that data and something as simple as just making paperwork easier for officers, that in itself could be a huge leg of growth. You think it's just paperwork. Paperwork takes a lot of time and takes a lot of effort away from doing the actual work that officers need to do is being out there in the field. Things like that, and then now they bought a drone company called Skydio, working to do something called drone as a first responder, where they can send out drones to monitor what's happening in the real world, and maybe triaging whether the officer can really go in there. Lots of great opportunities, but they got to execute to justify their valuation.
Emily Flippen: Another business that has to execute to arguably justify its valuation, although it's looking arguably a little bit cheaper today, is Mercado Libre. Now, in their quarter, they just topped 90 million unique active buyers, 68 million fintech users with an FX-neutral top-line growth of over 50%. Now, I rewind even further with Mercado Libre back to 2014. There's a Forbes article. They asserted that Mercado Libre was significantly overvalued at $87 a share. Since that valuation implied a 17% compounded annual growth in operating profit for the next decade, certainly a high bar. But I tell you what? It's been a decade, Jason. Mercado Libre, posted net operating profit, Kaeger, of over 40% for the past 10 years. At share price now sitting at just under $2,300 a share, what did you make of this report?
Jason Hall: It's exactly what you talked about when you and Sanmeet were talking about Axon. Two things can be true at the same time. They might seem diametrically opposing, where a stock can be overpriced. But the growth stories that can drive the results in it still a winning stock can still be there. The key with Axon is the growth opportunity has to be very large, and the company has to be led by people who can execute on a vision that many others just really don't see. In the case of Mercado Libre, you go back a decade ago, and this was just a company trying to build e-commerce in Latin America. What it's actually done is build the financial tools for buyers. This past quarter, we saw the dual flywheels of the e-commerce business, and payments continue to drive that growth. Since Mercado Libre operates in about a dozen and a half countries with different currencies, doesn't really move a lot of money around across those borders. The numbers that I'm talking about, they are currency neutral. Gross merchandise volume, that's the sum of all the transactions on the e-commerce platform. It was up 37% in the quarter. Here's the big one. Total payment volume, this is the value of all the transactions on its fintech platform, were up 61%. Here's a giant number. Total payment volume, almost $65 billion versus $15.3 billion in gross merchandise volume. That's a ton of money that's flowing through Mercado Libre that's going to other merchants and going to other payments, and it's a massive amount of valuable data. Now, let's look at the bottom line a little bit. Because of all the currency adjustments, Mercado Libre reports in US dollars, but essentially does no business in US dollars, so we really have to adjust that. Net income was down largely because of those foreign exchange adjustments. But adjusted free cash flow very strong even as it continues to spend a lot of money to build out its technology infrastructure and logistics infrastructure, the actual warehouse and distribution, and put a lot of capital to lending to consumers and merchants alike.
Emily Flippen: It's really hard to understate just how important that fintech business is also for the bottom line in terms of driving operating profits. But that's the optionality that comes with business like this. A decade ago, you didn't know about the fintech offerings. Same question to you, Jason. When you look out, this is an old compound. Does it have the ability to keep compounding for the next decade?
Jason Hall: Just as with Axon, which used to be called TASER International, got into the body cam business, got into the SaaS business as it started collecting all of that data, we're seeing a lot of the same thing that's driving the future for Mercado Libre because it's really that data that it's gaining through its payments business about the spending patterns and habits of its consumers and all of the data about its merchants that it's using to inform making good credit decisions. I don't think we need any new transformative businesses like Mercado Pago, but it's starting to reach into that Amazon playbook. It's building an ad business, so there's an incremental thing there. You look at those growth rates, and you think, these are crazy, they're unsustainable. Sure, they're going to come down over time. But I think we have to acknowledge how massive the market is. If we look at those 18 countries or so that it does business in, e-commerce is a fraction of total consumer spending in those countries, banking services, credit card usage, even smaller penetration than we see in developed economies. Now, here's the key, move fast and break things is great in tech, but not if you're lending money. We saw a blip on the radar last year with the credit businesses, default rates started to creep up. But what we've seen since then is that management is doing a good job so far of managing that risk. If it can keep being a good originator of debt, that's a very different operational skill set than the things that it's built its foundation on, and just ride the massive secular tailwinds of commerce and finance in Latin America, absolutely, Mercado Libre could remain a winning investment.
Emily Flippen: One thing I love about both those companies is that when you rewind time, it's really hard to find an analyst that didn't call them overhyped or expensive. Even among people who were fans of the investments, they always looked expensive, but that execution just kept compounding. It's a playbook that just seems to work time and time again. Coming up next, we'll have two new school compounders that are trying to run the same play. This is Motley Fool Money.
One of the great things about history is that while it might not repeat, it does rhyme. Reinvestors keep finding great ways to grow and analyst sometimes rightfully, sometimes regretfully, keep calling them overvalued. Let's dive into two companies that are proving the history of compounders isn't changing yet today. Both Hims & Hers and Palantir, they both reported earnings. Both still had their fair number of skeptics. But, Jason, let's start with Hims & Hers. This is a telehealth platform that's known for compounding more than just returns in terms of its popular compounded drug offerings. Their revenue growth has risen at triple digit in recent years, and the business is converting new customers left and right. But at the same time, there was a Seeking Alpha article posted last month that claimed Hims was potentially ""too late to buy"" after shares have doubled with a fair value closer to $40 per share. Based on what you're seeing in the most recent report, Jason, do you agree it's too late for investors to jump in on this bandwagon?
Jason Hall: First of all, I'll say it's a good thing that I'm talking about Hims & Hers and not Palantir, considering that I'm using options to short it, and we'd get a lot of emails about that. I'm not going to even talk about Palantir. But when you look at what's going on with Hims & Hers, I think it's less about whether it's an overpriced stock and whether its future is going to be more like Mercado Libre and less like some overhyped pass flyer that came down to Earth. What that's going to work out to is the extremely large market opportunities that are in front of it. In this case, we're talking about healthcare spending. Now, here's the thing. The core of Hims & Hers today it's really about prescribing medications and ideally, ones that it can compound in its own pharmacies, where it can earn the bulk of the profits that otherwise are shared more with pharma. Just, for example, it has about 2.4 million subscribers. Massive growth in subscribers continues year over year, quarter over quarter. Of that 2.4 million, 1.5 million are on what it calls a personalized treatment plan. That generally means that it's compounding a special dose or it's combining multiple medications into a single deliverable, like a gummy, something that's not commercially available. Now the question about this business model is, how large can it become? What percentage of the actual spend for pharmaceuticals can that actually be? Then it also ties to its incentive structure for physicians, which is heavily tied to writing a prescription. Can that remain viable? I think we've all read the reports of customers being written a prescription with less than a couple of minutes of interaction with a physician.
Up next is expansion and more vertical integration. We're seeing they're spending a ton of money to increase their lab testing capabilities and then start delivering even more personalized medical services. The bottom line here is the healthcare industry is worth trillions of dollars, and some disruption to the status quo in this extremely regulated space is probably a really good thing. But Hims & Hers having a future that looks more like Mercado Libre or Axon is going to require it to do more than just being a compounding prescription factory. It needs to become a vertically integrated healthcare business that beats those entrenched players at their own game by some degree, reinventing how that game is played, too.
Sanmeet Deo: The only thing that I'll say about Hims is it's still very early in its growth, high risk, high opportunity. It's developing a healthcare platform unlike we've probably seen, unlike we probably can even imagine. It's going to be hard. It's going to take a lot of work, but there's a lot of growth areas that it can grow into, and it's just going to take a lot of time for it to cook.
Jason Hall: Exactly. It's an execution play, not a valuation play.
Emily Flippen: That's beautifully said, and I think we spend a fair bit of time on Motley Fool Money talking about Hims, and in hindsight, it might be one of those companies that flames out. We don't talk about it a decade from now, or it could be the Mercado Libre, where a decade from now the opportunity seems so obvious that we wonder why we didn't spend more time discussing it. It's binary in that regard, but I'm really excited to see where it takes us. But Jason, as you alluded to, I'm really excited to talk about Palantir here. I'll spare you. You are obviously a bear on Palantir. Maybe we'll have to have you on at some point in the future to give us some more context behind that thought. But, Sanmeet, I want to go to you. This is a really lucrative business, but one that has all these secretive government contracts, and that has created an incredible opportunity for high rates of return on its capital, but not everyone is sold. One analyst claimed the stock is both overhyped and overpriced, given the fact that it trades at a price-to-sales ratio north of 70 times. I have to admit that does sound pretty expensive. What are you seeing here?
Sanmeet Deo: This is the most expensive stock on the market, probably, but this is a classic Rule Breaker in so many senses of the term that intuitively it just feels, and I will say here now and I've said it before on some of our other shows, I think it will be a trillion-dollar company at some point. It will hit its slide, growth will slow. It will take a correction as all Rule Breakers have. The growth that they're doing right now at such a high margin, expanding from the government to the commercial side of the business, and basically becoming the operating system of AI. Short term, it could be a great short. Long term, I think it's going to be a fantastic compound that I think we're talking about as one of the premier software companies.
Emily Flippen: Well, I can't wait to have you both on at some point in the future to have the two opinions here between the actively buying puts and the belief that Palantir could be a trillion-dollar company, too. That is what makes a market two entirely separate opinions.
Jason Hall: I think both of those could be true, though.
Emily Flippen: It's true.
Jason Hall: We're going to see.
Emily Flippen: When we get back from this break, we'll be doing tariff math in a minute. Stick with us.
Policy shifts on tariffs are in motion. As you wrap up here, let's do a little bit of tariff math. That could go a long way for investors. For starters, let's take a look at hardware plus software business, Zebra. Zebra reported earnings this morning, and management had to spell it out clearly for investors. There's a $30 million operating profit headwind, just from import tariffs alone, which reduced their EBITDA margin by nearly a full percentage point. Doesn't sound like a lot. But when you're Zebra, that's a lot of cash. In other pure hardware companies, they're expected to be impacted even more. Caterpillar saw its operating profit fall 18% this quarter, again, largely due to tariffs. Now, I know exact math is impossible here, but when you look at businesses that can mitigate the impact of tariffs that have decent pricing power, Jason and Sanmeet, I want to go quick Round Robin. Where, if anywhere, is pricing power strong enough that the cost can be passed along enough to mitigate the costs of tariffs?
Sanmeet Deo: I think that On Holdings is a great company with tons of pricing power. They have premium brands. Shoes are priced very highly, $150 and up. They have very high, 50% and above gross profit margin, which indicates pricing power. They're willing to raise prices, and they have just a very significant channel to do it with their direct consumers. I believe they have pretty strong pricing power.
Jason Hall: I think you pretty much are going to see it in consumer brands, largely, that's where you see it. Coca-Cola is a good example. One of the reasons that Warren Buffett has loved the company as long as he has is because their ability to raise prices, even as volumes of Coke and Diet Coke in the US have declined. They've raised prices enough to more than offset the loss of the volume. That's a good example. Even now, a company, though, who's been a loser to the market over the long-term. Pricing power is still no guarantee of returns. Ferrari, I think, is a primo example of a company in an industry that you don't associate pricing power. Automakers are price takers. They're heavily competitive. But when you control the market, yeah, there's plenty of hypercars out there, but there's only one Ferrari, and your motto is to provide the market with one less than it demands every year, you have pricing power.
Sanmeet Deo: What's 251,000 versus 250,000? No, big deal. There you go.
Emily Flippen: Exactly. [laughs] I was going to say Lululemon. Now, they haven't historically been able, at least since the tariffs have been in place over the course of 2025, been able to pass those prices along, but I do think they had the type of audience and consumers, as well as the pricing power to at least mitigate the majority of tariff impacts. But Sanmeet, actually, in hindsight, I agree. I think On Holdings is probably where it's at. They're expanding into apparel as well. Despite the fact that I think Lululemon looks scarily cheap right now and pretty balanced risk-reward investment, I do think on is, to your point, probably in a better position there. But I guess time will tell, both for tariffs as well as future compounders. Really looking forward to where these companies are a decade from now. Sanmeet and Jason, thank you both so much for joining.
As always, people on the program may have interest in the stocks they talk about, and the Motley Fool may have formal recommendations for or against. Don't buy or sell stocks based solely on what you hear. All personal finance content follows the Motley Fool editorial standards, and it's not approved by advertisers. Advertisements are sponsored content and provided for informational purposes only. To see our full advertising disclosure, please check out our show notes. For Sanmeet Deo, Jason Hall, and the entire Motley Fool Money team, I'm Emily Flippen. We'll see you tomorrow.
Emily Flippen, CFA has positions in Axon Enterprise and MercadoLibre. Jason Hall has positions in MercadoLibre and has the following options: long December 2027 $80 puts on Palantir Technologies. Sanmeet Deo has positions in Amazon, Axon Enterprise, Hims & Hers Health, On Holding, and Palantir Technologies. The Motley Fool has positions in and recommends Amazon, Axon Enterprise, Hims & Hers Health, Lululemon Athletica Inc., MercadoLibre, Palantir Technologies, and Zebra Technologies. The Motley Fool recommends Ferrari and On Holding. The Motley Fool has a disclosure policy.
Capital Compounders for Investors was originally published by The Motley Fool",56383afa7d613b706e66b5fc9d4eb6aa,trafilatura,22539,0
