url,url_hash,title,description,published_at,source_id,source_name,crawl_method,language,paywall,text,content_hash,extract_method,text_len,method_rank
https://finance.yahoo.com/news/prediction-reddit-stock-could-outperform-100500208.html,35337e099363af4ee667168c682c2b9f,Prediction : Reddit Stock Could Outperform Meta and Snap Over the Next 12 Months,Prediction : Reddit Stock Could Outperform Meta and Snap Over the Next 12 Months,2025-08-10 12:00:00+00:00,gdelt_finance_yahoo_com,finance.yahoo.com via GDELT,gdelt,en,False,"One of the hottest tech companies on the stock market is also, in a way, one of its more old-fashioned. Reddit's (NYSE: RDDT) website doesn't feature flashy graphics or funky designs; rather, it's a set of online discussions about almost any topic imaginable.
This outwardly mundane presentation hides a high-potential operation that has more than proved it can deliver the goods for investors. Given that, I think the stock price growth of the dowdy-looking Reddit can trounce that of social media peers Meta Platforms(NASDAQ: META) and Snap (NYSE: SNAP) over the coming year.
The social media rock star of the moment
The excitement over Reddit across the past few days stems from its second-quarter earnings report, published Friday morning to a thunderously positive reception by the market (which sent the share price more than 21% skyward in morning trading alone).
Revenue surged 78% higher on a year-over-year basis to $500 million, powered by all-important ad sales that rose 84% to $465 million. The bottom line according to generally accepted accounting principles (GAAP) flipped to a well-in-the-black profit of $89 million, against a $10 million deficit in the same quarter of 2024. Free cash flow (FCF) ballooned by $84 million across that stretch to $111 million. Both headline figures blew past analyst estimates.
As for operational metrics, the company's count for daily active uniques (DAUq) -- users that it defines as those ""whom we can identify with a unique identifier who has visited a page on the Reddit website ... or opened a Reddit application at least once during a 24-hour period"" -- leaped by 21% year over year to over 21 million souls. How's that for engagement?
Reddit's guidance for its current (third) quarter was similarly impressive. It's projecting $535 million to $545 million for revenue, and adjusted earnings before interest, taxes, depreciation, and amortization (EBITDA) of $185 million to $195 million. Analysts were anticipating a top line of barely over $473 million.
The right site at the right time
So, what's the secret sauce for Reddit?
Sure, management has launched several clever, growth-fueling initiatives, including dynamic product ads (DPA), rolled out in May. These spots match topics of the site's ""subreddits,"" and embed within them to serve users who are obviously or apparently looking to buy such products/services. In the ideal case, the ads are doubly beneficial, as a shopper in need of guidance gets a tailored recommendation, and a theoretically ideal consumer is targeted by an advertiser.
Also in the realm of ads, Reddit is future-forward with its embrace of artificial intelligence (AI) tools for ad creation. With these, an advertiser can garner real-time information on trends in the discussion threads, plus integrate positive user comments into the ads themselves.
But I don't believe Reddit's big leaps are mostly due to these (admittedly impressive) technologies. Rather, I think it's more a function of what the company offers as a service. With the ability to generate meaningful discussion about almost anything and provide answers for a near-limitless variety of questions or concerns, Reddit is growing in both authority and utility.
As successful as Meta's Facebook and Instagram and Snap's offerings have been, they're not really venues for information swapping or edification. They're fun places to share things with friends and acquaintances. However, you would be hard-pressed to quickly access an effective informational discussion on the history of the Habsburg Empire.
I think analysts tracking social media and big-tech stocks have cottoned on to this. They're modeling nearly 60% (!) annual growth for Reddit on the top line for full-year 2025, with a 31% boost in 2026. The collective estimate for per-share profitability is $1.86, a night-and-day improvement over a $3.33 loss in 2024. That should balloon by 61% (!!) in 2026.
Neither revenue nor profitability are expected to surge anywhere near that high for Meta from 2025 to 2026. Analysts forecast Snap will improve its bottom line by 42% across that stretch, but with revenue growth of 11%.
High performance attracts investors, of course, so Reddit's valuations are comparatively much higher than its social media cousins (a dizzying 121 forward price-to-earnings ratio, for example, against Snap's under 37, and Meta's sub-29). Yet this company has clearly captured the zeitgeist and possesses the user stickiness, the resources, and the managerial acumen to keep up those massive growth rates.
Of that trio, then, I would unhesitatingly buy Reddit stock.
Should you buy stock in Reddit right now?
Before you buy stock in Reddit, consider this:
The Motley Fool Stock Advisor analyst team just identified what they believe are the 10 best stocks for investors to buy now… and Reddit wasn’t one of them. The 10 stocks that made the cut could produce monster returns in the coming years.
Consider when Netflix made this list on December 17, 2004... if you invested $1,000 at the time of our recommendation, you’d have $636,563!* Or when Nvidia made this list on April 15, 2005... if you invested $1,000 at the time of our recommendation, you’d have $1,108,033!*
Now, it’s worth noting Stock Advisor’s total average return is 1,047% — a market-crushing outperformance compared to 181% for the S&P 500. Don’t miss out on the latest top 10 list, available when you join Stock Advisor.
Eric Volkman has no position in any of the stocks mentioned. The Motley Fool has positions in and recommends Meta Platforms. The Motley Fool has a disclosure policy.",86e1f389181f270ced58337ea014e886,trafilatura,5595,0
https://finance.yahoo.com/news/dear-plug-power-stock-fans-161845742.html,9834b10ef935de6eb27f930234810ca2,"Dear Plug Power Stock Fans , Mark Your Calendars for August 11","Dear Plug Power Stock Fans , Mark Your Calendars for August 11",2025-08-10 17:45:00+00:00,gdelt_finance_yahoo_com,finance.yahoo.com via GDELT,gdelt,en,False,"Analysts have become bullish on hydrogen after President Donald Trump’s One Big Beautiful Bill (OBBB) passed. The recent legislation provides for extended tax cuts and lays the groundwork for the long-term prospects of clean energy projects. Plug Power (PLUG), as a primary player in the hydrogen fuel cell business, stands to benefit significantly from this legislation.
The OBBB Act provides a 30% credit on all fuel cell purchases, while also eliminating some requirements, which broadens credit access. The act also extends the hydrogen production tax credit.
In the face of bullish sentiments about hydrogen, Plug Power is set to report its second-quarter results on Aug. 11 after the market close. Should you be excited about the upcoming earnings and PLUG stock?
About Plug Power Stock
Incorporated in 1997 and headquartered in Latham, New York, Plug Power develops hydrogen fuel cell systems used primarily to replace conventional batteries in electric vehicles (EVs) and equipment powered by electricity. Plug Power has a market capitalization of $1.73 billion.
Plug Power designs and manufactures fuel cells for applications in material handling, stationary power, and on-road vehicles. Beyond fuel cells, the company is building a comprehensive green hydrogen ecosystem, including production, storage, transportation, and refueling infrastructure. Plug Power is also investing in global expansion and innovation in electrolyzer technology to meet growing demand in the renewable energy and hydrogen markets.
Concerns over Plug Power’s financials have not been favorable to the stock. Over the past 52 weeks, PLUG stock has declined by 27%, and so far this year, it has decreased by 29%. The stock had reached a 52-week high of $3.32 in January but is now down nearly 55% from that high.
Plug Power still has a lofty valuation. Its price-to-sales ratio is at 2.75 times, which is stretched compared to the industry average.
Plug Power’s Q1 Top Line Growth and Bottom Line Snags
On May 12, Plug Power reported its Q1 earnings for fiscal 2025. For the period, net revenue increased by 11.2% year-over-year (YOY) to $133.67 million, surpassing the $132.2 million that analysts had expected. Plug Power cited expanding electrolyzer deliveries, sustained demand in material handling, and “ongoing deployments” of its cryogenic platform as reasons for this growth.
While the topline growth has been holding steady, Plug Power remains unprofitable. It reported a quarterly gross loss of $73.86 million, which reflected an improvement from the prior year’s period. Plug Power also reported a loss of $0.21 per share, marking an improvement over the $0.46 loss per share in the year-ago period but missing the consensus Wall Street analyst estimate of a loss of $0.20 per share.
The company has also formed some meaningful partnerships recently. In July, Plug Power signed a multi-year supply agreement with a popular industrial gas company. This secures a long-term supply of hydrogen while lowering costs and potentially improving profitability. Plug also signed a commercial agreement with Uline, a logistics firm, establishing a strategic relationship that will last through 2030.
For the second quarter, Plug Power expects revenue to be in the range of $140 million to $180 million. The company also expects improvements in its gross margin and working capital levels. With its newly online capacity in Louisiana, the company aims to improve margins and reduce third-party fuel costs.
Wall Street analysts are still optimistic about Plug Power’s ability to recover its losses. They expect the company’s loss per share to narrow by 58.3% YOY to $0.15 for the second quarter. For fiscal 2025, they forecast a 78% improvement to a loss per share of $0.59, then a 42.4% improvement to a loss of $0.34 in fiscal 2026.
What Do Analysts Think About Plug Power Stock?
Several Wall Street analysts, while not entirely bullish on Plug Power, have notably raised their price targets on PLUG stock. In July, analysts at Jefferies raised the price target on shares from $0.90 to $1.60, while keeping their “Hold” rating. Analysts view the OBBB Act as a “clearing event,” although they are not entirely convinced about “the renewable names.”
In the same month, while expecting growth, Susquehanna analyst Biju Perincheril maintained a 'Neutral' rating on Plug Power stock. However, Perincheril also raised the price target significantly from $1 to $1.80, indicating a fresh bout of optimism.
Wall Street analysts recommend caution at the moment, giving Plug Power a consensus “Hold” rating overall. Of the 22 analysts rating the stock, five give it a “Strong Buy” rating, while four give it a “Strong Sell” rating. On the other hand, a majority of 13 analysts play it safe with a “Hold” rating. The consensus price target of $1.95 represents 29% potential upside from current levels.
On the date of publication, Anushka Dutta did not have (either directly or indirectly) positions in any of the securities mentioned in this article. All information and data in this article is solely for informational purposes. This article was originally published on Barchart.com",154041cccb64a4e4a992ba35c7654556,trafilatura,5157,0
https://finance.yahoo.com/news/magnificent-vanguard-etf-just-hit-160000955.html,0fd315332248849df9d25de5d4e17067,This Magnificent Vanguard ETF Just Hit an All - Time High . Should You Invest Now or Wait ? ,This Magnificent Vanguard ETF Just Hit an All - Time High . Should You Invest Now or Wait ? ,2025-08-10 17:45:00+00:00,gdelt_finance_yahoo_com,finance.yahoo.com via GDELT,gdelt,en,False,"The stock market has had a roller-coaster of a year, both entering correction territory and setting new all-time highs within a matter of months.
It is not surprising, then, that investor sentiment is mixed right now. While around 35% of investors feel optimistic about the next six months, according to the most recent weekly survey from the American Association of Individual Investors, around 43% are pessimistic about the future.
Many stocks and funds are still reaching new heights, but is it safe to invest right now? Here's what you need to know.
An unstoppable growth ETF reaching record highs
Despite mixed feelings among investors, many funds are still surging -- including the Vanguard S&P 500 Growth ETF(NYSEMKT: VOOG). This exchange-traded fund (ETF) reached a new all-time high on Aug. 8, climbing by more than 38% since its low point in early April of this year.
Although the market still faces a threat of a downturn or recession -- especially as new tariff policies begin taking effect -- this ETF is more likely than many other investments to withstand volatility while still helping you build wealth.
The Vanguard S&P 500 Growth ETF includes only stocks that are listed in the S&P 500(SNPINDEX: ^GSPC). Making it into the S&P 500 is a high bar, and these stocks are among the largest and strongest in the U.S. While the index itself contains stocks from 500 companies, this ETF includes only 212 stocks with the most potential for growth.
That combination can make this ETF a particularly strong investment. Many stocks within the S&P 500 are industry-leading juggernauts, making them more likely to survive periods of volatility. At the same time, though, because this fund includes only those with the most growth potential, you're also more likely to see above-average returns over time.
In fact, over the last 10 years, the Vanguard S&P 500 Growth ETF has earned an average rate of return of 15.79% per year. The Vanguard S&P 500 ETF, by comparison, has earned an average return of 13.62% per year in that time.
Is it really safe to buy now?
Nobody knows when the next downturn will begin, how long it will last, or how severe it might be. But the good news is that, with the right strategy, there's never necessarily a wrong time to invest.
When stocks take a turn for the worse, your portfolio will likely lose value. But you don't technically lose any money unless you sell your investments for less than you paid for them. If you invest now, the market immediately plummets, and then you sell, you'll likely lock in significant losses.
However, if you simply hold your investment until stock prices eventually recover, your portfolio should regain any value it lost -- without you losing a dime.
For example, say you invested in the Vanguard S&P 500 Growth ETF in January 2022. The S&P 500 was about to descend into a bear market that would last nearly a year, and your ETF would have plunged by nearly 33% by October. But if you simply held on to your investment, you'd have earned total returns of nearly 36% by today.
In another scenario, say you'd waited until mid-2024 to buy. This ETF had fully recovered from the 2022 bear market by then, setting new record highs. While it may have felt safer to invest at that point -- and stocks still had many more months of growth ahead -- you'd have earned total returns of only around 23% by today.
Time is your best friend as an investor. If you can't hold your investments for at least five to seven years (or, ideally, a couple of decades), it can be a risky time to buy. In that case, you may be better off contributing to an emergency fund rather than investing your spare cash.
But if you're able to stay in the market for the foreseeable future, the Vanguard S&P 500 Growth ETF is more likely than many others not only to recover but also to go on to experience long-term growth. Time in the market is far more valuable than timing the market, no matter what the future may hold.
Should you invest $1,000 in Vanguard Admiral Funds - Vanguard S&P 500 Growth ETF right now?
Before you buy stock in Vanguard Admiral Funds - Vanguard S&P 500 Growth ETF, consider this:
The Motley Fool Stock Advisor analyst team just identified what they believe are the 10 best stocks for investors to buy now… and Vanguard Admiral Funds - Vanguard S&P 500 Growth ETF wasn’t one of them. The 10 stocks that made the cut could produce monster returns in the coming years.
Consider when Netflix made this list on December 17, 2004... if you invested $1,000 at the time of our recommendation, you’d have $653,427!* Or when Nvidia made this list on April 15, 2005... if you invested $1,000 at the time of our recommendation, you’d have $1,119,863!*
Now, it’s worth noting Stock Advisor’s total average return is 1,060% — a market-crushing outperformance compared to 182% for the S&P 500. Don’t miss out on the latest top 10 list, available when you join Stock Advisor.
Katie Brockman has positions in Vanguard Admiral Funds-Vanguard S&P 500 Growth ETF and Vanguard S&P 500 ETF. The Motley Fool has positions in and recommends Vanguard S&P 500 ETF. The Motley Fool has a disclosure policy.",af23db2a9bc184be857d13fb4e79a852,trafilatura,5145,0
https://finance.yahoo.com/news/2-high-yielding-etfs-rely-104500474.html,6dcd6c654285c3dae8c633a3a9ca669e,2 High - Yielding ETFs That You Can Rely on for Recurring Income,2 High - Yielding ETFs That You Can Rely on for Recurring Income,2025-08-10 12:00:00+00:00,gdelt_finance_yahoo_com,finance.yahoo.com via GDELT,gdelt,en,False,"Generating recurring income for your portfolio can be a great way to grow its value and provide you with a way to generate cash flow without having to sell stocks. You can then use that money to pay bills, pad your savings, or even have it reinvested back into stocks.
What's important when investing in income-generating investments is picking ones that you can safely rely on. Chasing high yields can lead to trouble later on if those payouts don't prove to be sustainable. In some cases, it's just bad luck where a dividend stock you've invested in ran into challenges that it couldn't get itself out of, and it had no choice but to reduce its payout.
Some risk is unavoidable when you're investing in individual stocks. And that's why, if your goal is to generate safe recurring income, you may want to consider investing in exchange-traded funds (ETFs) that can provide you with an easy way to diversify. Two ETFs that can be ideal options in this case are the Schwab U.S. Dividend Equity ETF(NYSEMKT: SCHD) and iShares Core High Dividend ETF(NYSEMKT: HDV). They both pay above-average dividends and can be excellent investments to hang onto for years.
Schwab U.S. Dividend Equity ETF
The Schwab U.S. Dividend Equity ETF promises investors a straightforward investing strategy that prioritizes things such as low costs, fundamental strength, and quality and safety when it comes to dividends. Those are essential items to consider when investing in dividend stocks. And at 0.06%, its expense ratio does indeed make it a low-cost fund, which makes it suitable for long-term investing; its fees won't put a big dent in your overall returns, even over several years.
With 103 holdings as of Aug. 5, the fund isn't overly diversified, and there are much larger ETFs. But what makes the Schwab fund ideal for income investors is its focus on quality stocks with good fundamentals. It isn't simply investing in a wide range of dividend stocks; the ETF carefully selects safe stocks, with many of them being high-yielding investments that pay more than the S&P 500 average of 1.2%.
Big-name stocks such as Merck, Verizon Communications, and PepsiCo are among its top holdings. By focusing on such high-yielding stocks, the ETF is able to average an overall yield of around 3.9%. That's exceptional, given the diversification you're getting with the fund.
In the past 12 months, the ETF is down over 1% but when including its dividend, its total return is positive and above 2%. And in five years, its total returns are north of 70%.
iShares Core High Dividend ETF
Another solid ETF to add to your portfolio can be the iShares Core High Dividend ETF. This fund is even more selective in its portfolio as it focuses on 75 of the best high-dividend stocks.
There will be some overlap with the Schwab fund, but one key difference is that in the Schwab ETF, the largest holding accounted for approximately 4.3% of the portfolio's weight, whereas in the iShares Core High Dividend fund, there are multiple stocks above that threshold. The top three stocks in this ETF -- ExxonMobil (8.5%), Johnson & Johnson (6.7%), and AbbVie (5.8%) -- account for a combined 21%.
So you get a bit less diversification with the fund and more of a position in its largest holdings, which isn't necessarily a bad thing. It's just important to be aware of the stocks you have the most exposure to, to ensure that you're comfortable with them.
The fund's expense ratio is 0.08%, which is comparable to the other fund on this list. Its yield of 3.5% is a bit smaller, but it's still a high payout overall. The bulk of its portfolio is allocated to sectors that have a great deal of long-term stability: healthcare, energy, and consumer staples. Collectively, those sectors represent 64% of all the stocks within the ETF.
This year, as investors have been seeking out safe stocks, the iShares ETF has rallied 6% in value, and with its dividend, the total return is nearly 8%.
Should you invest $1,000 in Schwab U.S. Dividend Equity ETF right now?
Before you buy stock in Schwab U.S. Dividend Equity ETF, consider this:
The Motley Fool Stock Advisor analyst team just identified what they believe are the 10 best stocks for investors to buy now… and Schwab U.S. Dividend Equity ETF wasn’t one of them. The 10 stocks that made the cut could produce monster returns in the coming years.
Consider when Netflix made this list on December 17, 2004... if you invested $1,000 at the time of our recommendation, you’d have $636,563!* Or when Nvidia made this list on April 15, 2005... if you invested $1,000 at the time of our recommendation, you’d have $1,108,033!*
Now, it’s worth noting Stock Advisor’s total average return is 1,047% — a market-crushing outperformance compared to 181% for the S&P 500. Don’t miss out on the latest top 10 list, available when you join Stock Advisor.
David Jagielski has no position in any of the stocks mentioned. The Motley Fool has positions in and recommends AbbVie and Merck. The Motley Fool recommends Johnson & Johnson and Verizon Communications. The Motley Fool has a disclosure policy.",6f49ca37c7ef9c1fe56e673bfe7e51c1,trafilatura,5091,0
