url,url_hash,title,description,published_at,source_id,source_name,crawl_method,language,paywall,text,content_hash,extract_method,text_len,method_rank
https://finance.yahoo.com/news/3-growth-stocks-down-8-120000876.html,ec40c67cb44864a54900db6c4a4cd650,3 Growth Stocks Down 8 % to 77 % to Buy in August,3 Growth Stocks Down 8 % to 77 % to Buy in August,2025-08-10 13:30:00+00:00,gdelt_finance_yahoo_com,finance.yahoo.com via GDELT,gdelt,en,False,"Investors should never let market volatility scare them out of a good investment. Stocks of growing companies will usually experience greater volatility than the market average. But investors that ignore those fluctuations and keep regularly buying shares of growing companies will come out ahead over the long run.
Three fool.com contributors see great deals right now for fallen growth stocks like Amazon(NASDAQ: AMZN), Dutch Bros(NYSE: BROS), and Sweetgreen(NYSE: SG). Here's why they believe these stocks are solid investments for a long-term investor.
Amazon: Down 8.5%
Jennifer Saibil (Amazon): Amazon reported spectacular results for the 2025 second quarter last week, but its stock dropped on the news. While there was a lot to be excited about, the market seemed to home in on certain qualities that didn't fully meet its expectations, and that has created an excellent opportunity for investors who haven't pressed the buy button yet.
Sales growth was strong at 13% year over year, beating expectations. Let's not forget that Amazon is the second-largest company in the U.S. by sales, and to be able to still deliver double-digit sales growth is an impressive feat. It reached $167.7 billion in sales, ahead of Walmart's $165.6 billion in sales in its most recent quarter, and Amazon is on track to become the largest company in the U.S. by sales.
Operating income surged to $19.2 billion, up from $14.7 billion last year, easily topping its guidance. But that wasn't enough for Wall Street.
The market seems to have been spooked by the outlook for operating margin coming in slightly below expectations. Management is shooting for $15.5 billion to $20.5 billion in third-quarter operating income, and Wall Street is expecting $19.5 billion.
It also wasn't thrilled with the performance of Amazon Web Services (AWS), Amazon's cloud business. AWS sales were up 17.5% year over year in the quarter, but that was nowhere near the growth of its two biggest rivals, Microsoft's Azure and Alphabet, which increased 39% and 32%. However, AWS is much bigger than both of them, and in dollar amounts, its increase surpassed them.
CEO Andy Jassy made some remarks about the artificial intelligence (AI) business that may have sounded worse than he expected. He explained that it couldn't meet demand right now, which is why it's investing heavily in the platform. While that could lead clients to find somewhere else to meet their demand, the high demand implied should be great for Amazon down the line, as long as it can build out fast enough to keep it going.
Amazon stock is down 8.5% from its highs, already making its way back up as investors recognize the opportunity to buy on the dip. This was an overcorrection, and now it's a great chance to buy before it reaches new highs.
Dutch Bros: Down 33%
John Ballard (Dutch Bros): Dutch Bros has all the ingredients of a growth stock set up to deliver multi-bagger returns for patient shareholders. It's tapping into growing demand for specialty beverages. The business was founded in 1992, but it's still early in its nationwide U.S. expansion plans.
Analysts expect revenue to grow at a compound annual rate of 23% over the next few years. This is in line with the company's current pace of shop openings and same-shop sales trends, which have hovered around the low to mid-single-digit level over the last few years. It currently has over 1,000 shops in 18 states, but management sees tremendous growth potential supporting as many as 7,000 locations over the long term.
Dutch Bros is outperforming Starbucks, which has experienced problems growing sales recently. One reason for Dutch Bros' success is that it likes to hire shop managers from within the company. Even some of the company's franchise partners started out working for Dutch Bros as ""broistas."" This can help promote consistency throughout the company's shops, which is an important quality to look for in any restaurant chain.
Another quality that leads me to have high conviction in the future of this brand is that it is very popular among Gen Z. Dutch Bros offers a fun-loving atmosphere and a focus on the drive-thru experience, and it goes out of its way to delight customers with limited time offerings, such as the recent rubber duck giveaway with every purchase. The little things can go a long way in winning loyal customers, and Dutch Bros seems to understand this well.
The stock is currently down about 33% from its 52-week high. I would consider taking advantage of the dip and adding shares, especially for investors who are interested in finding promising new restaurant brands in the early stages of expansion.
Sweetgreen: Down 77%
Jeremy Bowman (Sweetgreen): Restaurant stocks have struggled this year as a combination of fears about tariffs and weak consumer discretionary spending have weighed on both business results and stock performance.
Sweetgreen, the promising fast-casual salad chain, has been one of the worst-performing stocks in the industry. The stock is now down 61% year to date, and is off 77% from its all-time high shortly after the company went public in late 2021.
It's understandable why Sweetgreen is down based on its recent results. In its first quarter, same-store sales declined 3.1%, and revenue rose just 5.4%. Sweetgreen has also been unprofitable throughout its history.
However, the chain is still small with roughly 250 locations, and it is popular as its restaurants generate average sales of $2.9 million. That puts it on par with Chipotle, one of the most successful restaurant stocks in history.
Sweetgreen has also been unprofitable in part because it's invested in its Infinite Kitchen program, an automated system that measures and dispenses ingredients and helps prep its salad bowls. That innovation seems likely to pay off over the long run. Management has said that restaurants with the Infinite Kitchen generate higher sales, as it helps increase throughput and customer service, in addition to saving on labor costs.
Sweetgreen's comparisons are expected to get easier in the second half of the year, which could turn comparable sales positive. The company expects to open at least 1,000 stores over the long term, meaning it has a long growth runway ahead.
Investors who take advantage of the discount are likely to be rewarded.
Do the experts think Amazon is a buy right now?
The Motley Fool’s expert analyst team, drawing on years of investing experience and deep analysis of thousands of stocks, leverages our proprietary Moneyball AI investing database to uncover top opportunities. They’ve just revealed their 10 best stocks to buy now — did Amazon make the list?
When our Stock Advisor analyst team has a stock recommendation, it can pay to listen. After all, Stock Advisor’s total average return is up 1,047% vs. just 181% for the S&P — that is beating the market by 865.68%!*
Imagine if you were a Stock Advisor member when Netflix made this list on December 17, 2004... if you invested $1,000 at the time of our recommendation, you’d have $636,563!* Or when Nvidia made this list on April 15, 2005... if you invested $1,000 at the time of our recommendation, you’d have $1,108,033!*
The 10 stocks that made the cut could produce monster returns in the coming years. Don't miss out on the latest top 10 list, available when you join Stock Advisor.
Jennifer Saibil has positions in Walmart. Jeremy Bowman has positions in Amazon, Chipotle Mexican Grill, Starbucks, and Sweetgreen. John Ballard has no position in any of the stocks mentioned. The Motley Fool has positions in and recommends Alphabet, Amazon, Chipotle Mexican Grill, Microsoft, Starbucks, and Walmart. The Motley Fool recommends Dutch Bros and Sweetgreen and recommends the following options: long January 2026 $395 calls on Microsoft, short January 2026 $405 calls on Microsoft, and short September 2025 $60 calls on Chipotle Mexican Grill. The Motley Fool has a disclosure policy.",6cd6df7553deab2218ebfa20a798e884,trafilatura,7940,0
https://finance.yahoo.com/news/3-no-brainer-warren-buffett-080500293.html,017228bd34cf4cc51a87504e75a83094,3 No - Brainer Warren Buffett Stocks to Buy Right Now,3 No - Brainer Warren Buffett Stocks to Buy Right Now,2025-08-10 11:00:00+00:00,gdelt_finance_yahoo_com,finance.yahoo.com via GDELT,gdelt,en,False,"Veteran investors know the market is forever changing, requiring you to change with it. These changes include industry leadership, stock-selection strategies, allocation adjustments, and more.
There are still some reliable constants though. One of them is Warren Buffett, and the picks he makes -- or at least approves -- for Berkshire Hathaway's (NYSE: BRK.A)(NYSE: BRK.B) portfolio. If a stock becomes a Berkshire holding, you can bet it's a quality name with a promising future.
Here's a closer look at three Warren Buffett picks currently held by Berkshire Hathaway that just might work for your portfolio as well.
1. American Express
Buffett's done a fair amount of selling over the past few quarters, lightening up on Berkshire's positions in Apple, Bank of America, and DaVita, and outright exiting its stakes in Citigroup and Nu Holdings.
One stock has remained conspicuously untouched for years now, however, to quietly become Berkshire Hathaway's second-biggest holding (right behind Apple). That's credit card outfit American Express(NYSE: AXP).
It's not too difficult to see why Buffett's such a fan, though; the company's certainly more than proven it knows how to make its unique business model work.
On the surface it's just another credit card company. Under the hood though, it's more. Unlike Visa and Mastercard, which are only payment networks for card issuers, American Express is both the issuer and the payment middleman.
This leveraged position allows it to offer a perks and rewards program that cardholders are willing to pay up to $700 per year just to access. This annual fee also means American Express' cardholders tend to be a bit more affluent than the average consumer, and as such are less likely to miss payments, and more likely to continue spending even when other people are tightening their purse strings.
And the proof is in the company's results. With the obvious exception of 2020 when the COVID-19 pandemic was in full swing, Amex's top line has improved every year going all the way back to 2017.
Profit growth hasn't been quite as consistent. It's remained reliable enough, however, to make American Express a solid dividend stock. Although the company tends to not raise its dividend payments in times of uncertainty -- like in the wake of 2008's subprime mortgage meltdown or during the COVID-19 pandemic -- it still continues to pay a quarterly dividend, and begins raising these payments again as soon as the economy makes it feasible to do so.
2. Occidental Petroleum
If it seems like the oil and gas business is inching its way to obsolescence, that's because it is. With the advent of electric cars and renewable energy sources, consumers just won't need oil like they have in the past. To this end, Goldman Sachs predicts ""peak oil"" -- the point at which the planet's daily consumption of crude stops growing and starts shrinking -- will happen in 2035.
There's a reason, however, that Buffett remains enough of a fan of oil giant Occidental Petroleum(NYSE: OXY) to stick with Berkshire's 265 million share position despite the stock's relatively poor performance of late. That is, there's still a great deal of money to be made in the business between now and then, and even after 2035.
See, while demand will likely start to shrink then, it's apt to shrink very, very slowly. Indeed, outlooks from ExxonMobil, OPEC, and Standard & Poor's all suggest that oil will still be the world's top source of energy production as far down the road as 2050. The continued proliferation of alternative energy options just won't be able to keep up with the ever-growing demand for electricity.
And Buffett feels very good about Occidental's ability to deliver, even in an environment where crude oil prices remain subdued. As he noted in 2023's letter (published in early 2024) to Berkshire Hathaway shareholders:
""Under Vicki Hollub's leadership, Occidental is doing the right things for both its country and its owners. No one knows what oil prices will do over the next month, year, or decade. But Vicki does know how to separate oil from rock, and that's an uncommon talent, valuable to her shareholders and to her country.""
That's strong personal praise from the Oracle of Omaha.
The kicker: Buffett also touted the potential of the carbon-capture technology that Occidental Petroleum is developing, which literally sucks carbon dioxide out of the ambient air. While it's not quite yet ready for mass commercialization, that day is coming, and soon, putting Occidental into what's apt to be another multibillion-dollar market.
3. Pool Corp.
Finally, add Pool Corp.(NASDAQ: POOL) to your list of Warren Buffett stocks you might want to buy for yourself right now.
It's the smallest and least-known of the three companies in focus here, with a market cap of only $11 billion. It's not a particularly big Berkshire holding either; the conglomerate's 1.5 million Pool Corp. shares are worth less than $500 million, which is less than 4% of Pool itself.
This relatively small stake makes Buffett's interest in the company all the more telling. While owning this much Pool stock doesn't actually do much for Berkshire's bottom line, Buffett and/or his lieutenants waded in anyway. There's a reason, even if it's not yet clear.
But first things first. Yes, this is the company that sells swimming pool supplies. It's the biggest name in the business, in fact, doing $5.3 billion worth of business last year. Of that, $617 million was turned into net income.
Curiously, both of those numbers were down from 2023's comparisons. Neither figure is expected to improve any this year, either. Berkshire bought the stock anyway despite its relatively rich valuation of 28 times this year's expected per-share profit of $10.88. It's a significant vote of confidence in this company's future growth prospects.
The thing is, it may not be a crazy bet at all.
There's no denying this stock's been a poor performer since 2021's peak, largely due to headwinds on the residential real estate front, where costs have soared. Investors are just worried, and understandably so.
As Buffett says though, ""Be fearful when others are greedy and greedy when others are fearful."" This business may be struggling right now, but it will eventually thrive again once the economy gets back up to full speed and the highly cyclical homebuying and home-improvement markets perk up, in turn driving demand for pools, and, subsequently, demand for pool maintenance supplies. Berkshire's just positioning in a quality company now for whenever that recovery materializes.
Should you buy stock in Occidental Petroleum right now?
Before you buy stock in Occidental Petroleum, consider this:
The Motley Fool Stock Advisor analyst team just identified what they believe are the 10 best stocks for investors to buy now… and Occidental Petroleum wasn’t one of them. The 10 stocks that made the cut could produce monster returns in the coming years.
Consider when Netflix made this list on December 17, 2004... if you invested $1,000 at the time of our recommendation, you’d have $636,563!* Or when Nvidia made this list on April 15, 2005... if you invested $1,000 at the time of our recommendation, you’d have $1,108,033!*
Now, it’s worth noting Stock Advisor’s total average return is 1,047% — a market-crushing outperformance compared to 181% for the S&P 500. Don’t miss out on the latest top 10 list, available when you join Stock Advisor.
American Express is an advertising partner of Motley Fool Money. Bank of America is an advertising partner of Motley Fool Money. Citigroup is an advertising partner of Motley Fool Money. James Brumley has no position in any of the stocks mentioned. The Motley Fool has positions in and recommends Apple, Berkshire Hathaway, Goldman Sachs Group, Mastercard, and Visa. The Motley Fool recommends Nu Holdings and Occidental Petroleum. The Motley Fool has a disclosure policy.",fe96d16fdc6c3b801d5f20f53c9a0ab6,trafilatura,7915,0
https://www.cnbc.com/2025/08/10/ai-artificial-intelligence-billionaires-wealth.html,9f1de1c1b768452a6d73d971ac4dedb9,AI is creating new billionaires at a record pace,AI is creating new billionaires at a record pace,2025-08-10 12:30:00+00:00,gdelt_cnbc_com,cnbc.com via GDELT,gdelt,en,False,"A version of this article first appeared in CNBC's Inside Wealth newsletter with Robert Frank, a weekly guide to the high-net-worth investor and consumer. Sign up to receive future editions, straight to your inbox.
Artificial intelligence startups have minted dozens of new billionaires this year, adding to an AI boom that's quickly becoming the largest wealth creation spree in recent history.
Blockbuster fundraising rounds this year for Anthropic, Safe Superintelligence, OpenAI, Anysphere and other startups have created vast new paper fortunes and propelled valuations to record levels. There are now 498 AI ""unicorns,"" or private AI companies with valuations of $1 billion or more, with a combined value of $2.7 trillion, according to CB Insights. Fully 100 of them were founded since 2023. There are more than 1,300 AI startups with valuations of over $100 million, the firm said.
Combined with the soaring stock prices of Nvidia, Meta, Microsoft and other publicly traded AI-related firms, along with the infrastructure companies that are building data centers and computing power and the huge payouts for AI engineers, AI is creating personal wealth on a scale that makes the past two tech waves look like warmups.
""Going back over 100 years of data, we have never seen wealth created at this size and speed,"" said Andrew McAfee, principal researcher at MIT. ""It's unprecedented.""
A new crop of billionaires is rising with sky-rocketing valuations. In March, Bloomberg estimated that four of the largest private AI companies had created at least 15 billionaires with a combined net worth of $38 billion. More than a dozen unicorns have been crowned since then.
Mira Murati, who left Open AI last September, launched Thinking Machines Lab in February. By July, she raised $2 billion in the largest seed round in history, giving the company a $12 billion valuation, according to reports.
Anthropic AI is in talks to raise $5 billion at a valuation of $170 billion, nearly three times its valuation in March. CEO Dario Amodei and its six other founders are now likely multibillionaires, according to people familiar with the company.
Anysphere was valued at $9.9 billion in a June fundraise and just weeks later was reportedly offered a valuation of $18 billion to $20 billion, likely making its 25-year-old founder and CEO, Michael Truell, a billionaire.
Granted, most of the AI wealth creation is in private companies, making it difficult for equity holders and founders to cash out. Unlike the dot-com boom of the late 1990s, when a flood of companies went public, today's AI startups can stay private for longer given the constant investment from venture capital funds, sovereign wealth funds, family offices and other tech investors.
At the same time, the rapid growth of secondary markets is allowing equity owners of private companies to sell their shares to other investors and provide liquidity. Structured secondary sales or tender offers are becoming widespread. Many founders can also borrow against their equity.
Open AI is holding talks for a secondary share sale to provide cash to employees. Its proposed valuation of $500 billion follows the company's fundraise in March that provided a $300 billion valuation.
Dozens of private firms are being acquired or merging, also providing liquidity. After Meta invested $14.3 billion in Scale AI, founder Alexandr Wang joined Meta's AI team. There have been 73 liquidity events — including mergers and acquisitions, IPOs, reverse mergers or corporate majority stakes — since 2023, according to CB Insights. Following the Meta deal, Scale AI's co-founder, Lucy Guo, who left the company in 2018, bought a mansion in LA's Hollywood Hills for around $30 million.
Still, the AI surge is largely centered in the Bay Area, reminiscent of the dot-com era. Last year, Silicon Valley companies raised more than $35 billion in venture funding, according to the Silicon Valley Institute for Regional Studies. San Francisco now has more billionaires than New York, with 82 compared with New York's 66, according to New World Wealth and Henley & Partners. The Bay Area's millionaire population has doubled over the past decade, compared with New York's growth of 45%.
More homes sold above $20 million in San Francisco last year than in any other year in history, according to Sotheby's International Realty. Rising rents, home prices and demand in the city, attributed in large part to AI, mark a sharp turnaround for a city facing a ""doom loop"" just a few years ago.
""It's astonishing how geographically concentrated this AI wave is,"" said McAfee, who is also co-director of MIT's Initiative on the Digital Economy. ""The people who know how to found and fund and grow tech companies are there. I've heard people say for 25 years 'This is the end of the Silicon Valley' or some other place is 'the new Silicon Valley.' But Silicon Valley is still Silicon Valley.""
With time, and initial public offerings, many of today's private AI fortunes will eventually become more liquid, providing a historic opportunity for wealth management firms. All of the major private banks, wirehouses, independent advisors and boutique firms are cozying up to the AI elite in hopes of winning their business, according to tech advisors.
Like the dot-com millionaires, however, luring the AI wealthy may be challenging for traditional wealth management companies. Simon Krinsky, executive managing director at Pathstone and former managing director at Hall Capital Partners in San Francisco, said most AI wealth is locked up in private companies and therefore can't be turned into wealth management accounts.
""I would say a much higher percentage of the ultimate wealth being created is illiquid,"" he said. ""There are ways of getting liquidity, but it's tiny compared to being employed at Meta or Google"" or another megacap publicly traded tech company.
Eventually, those fortunes will become liquid and prized by wealth management firms. Krinsky said the AI wealthy are likely to follow similar client patterns as the newly rich dot-commers of the 1990s. Initially, the dot-commers used their excess liquidity and assets to invest in similar tech companies they knew through their networks, colleagues or shared investors. He said the same is likely true for the AI wealthy.
""Everybody turned around and invested with their friends in the same kind of companies that created their own wealth,"" he said.
After discovering the perils of having all their wealth concentrated in one highly volatile and speculative industry, the dot-commers turned to wealth management. And being born disruptors, many turned their capital and skills toward reinventing the wealth management industry in their image. Netscape founder Jim Clark, for instance, helped launch MyCFO, a response to his dislike of bankers and the industry.
Krinksy said today's AI entrepreneurs are likely to follow the same path, with huge potential for AI to disrupt — if not replace — many of the traditional functions of wealth management.
Ultimately, however, the ultra-wealthy AI founders will discover the need for the traditional, personalized service that only dedicated wealth management teams can provide, whether it's around taxes, inheritances and estate planning, or philanthropy advice and portfolio construction.
""After people were beaten up or bruised up in the early 2000s, they came around to appreciating some degree of diversification and maybe hiring a professional manager to protect them from themselves,"" Krinksy said. ""I anticipate a similar trend with the AI group.""",97fdda9764832dcbbb997090c534af8f,trafilatura,7585,0
